{
  "$schema": "https://json-schema.org/draft/2020-12/schema",
  "$id": "https://specs.noema.dev/module-contracts.schema.json",
  "title": "NOEMA Module Contracts Document",
  "type": "object",
  "additionalProperties": false,
  "properties": {
    "schema_version": { "const": "module-contracts/1.0" },
    "product_version": { "type": "string", "minLength": 1 },
    "modules": {
      "type": "array",
      "minItems": 1,
      "items": {
        "type": "object",
        "additionalProperties": false,
        "required": [
          "module",
          "purpose",
          "owns_state",
          "reads",
          "writes",
          "inputs",
          "outputs",
          "dependencies",
          "forbidden_dependencies",
          "transaction_boundary",
          "idempotency",
          "failure_modes",
          "observability",
          "security_boundary",
          "determinism_requirements",
          "conformance_cases"
        ],
        "properties": {
          "module": { "type": "string", "minLength": 1 },
          "purpose": { "type": "string", "minLength": 1 },
          "owns_state": { "type": "array", "items": { "type": "string" } },
          "reads": { "type": "array", "items": { "type": "string" } },
          "writes": { "type": "array", "items": { "type": "string" } },
          "inputs": { "type": "array", "items": { "type": "string" } },
          "outputs": { "type": "array", "items": { "type": "string" } },
          "dependencies": { "type": "array", "items": { "type": "string" } },
          "forbidden_dependencies": { "type": "array", "items": { "type": "string" } },
          "transaction_boundary": { "type": "string" },
          "idempotency": { "type": "string" },
          "failure_modes": { "type": "array", "items": { "type": "string" } },
          "observability": { "type": "string" },
          "security_boundary": { "type": "string" },
          "determinism_requirements": { "type": "string" },
          "conformance_cases": { "type": "array", "items": { "type": "string" } }
        }
      }
    },
    "hard_rules": {
      "type": "array",
      "items": { "type": "string" }
    }
  },
  "required": ["schema_version", "product_version", "modules", "hard_rules"]
}
