{
  "schema_version": "module-contracts/1.0",
  "product_version": "0.1.0",
  "modules": [
    {
      "module": "gateway",
      "purpose": "HTTP/WebSocket framing and connection lifecycle",
      "owns_state": [
        "connections"
      ],
      "reads": [
        "auth sessions"
      ],
      "writes": [],
      "inputs": [
        "client frames"
      ],
      "outputs": [
        "routed messages"
      ],
      "dependencies": [
        "auth"
      ],
      "forbidden_dependencies": [
        "world_state"
      ],
      "transaction_boundary": "per connection message; acknowledgements update delivery bookkeeping only",
      "idempotency": "ping/reconnect safe; resume tokens scoped by world principal stream and session epoch",
      "failure_modes": [
        "disconnect",
        "protocol error",
        "resume position expired"
      ],
      "observability": "connection metrics, per-stream ack cursor, redelivery window status",
      "security_boundary": "TLS/origin checks",
      "determinism_requirements": "no wall-clock reduce input",
      "conformance_cases": [
        "C01",
        "C07",
        "C12"
      ]
    },
    {
      "module": "auth",
      "purpose": "Authenticate principals and issue/verify tokens",
      "owns_state": [
        "credentials hashes",
        "sessions"
      ],
      "reads": [],
      "writes": [
        "session records"
      ],
      "inputs": [
        "AUTH requests"
      ],
      "outputs": [
        "principal bindings"
      ],
      "dependencies": [],
      "forbidden_dependencies": [
        "world_engine"
      ],
      "transaction_boundary": "token verify atomic",
      "idempotency": "token replay rules",
      "failure_modes": [
        "invalid token",
        "expired"
      ],
      "observability": "auth failures",
      "security_boundary": "secrets never agent-visible",
      "determinism_requirements": "n/a for world reduce",
      "conformance_cases": [
        "C02",
        "C12"
      ]
    },
    {
      "module": "agent_registry",
      "purpose": "Register agent identity and manifests",
      "owns_state": [
        "agents",
        "manifests",
        "agent_versions"
      ],
      "reads": [
        "auth principals"
      ],
      "writes": [
        "registry rows"
      ],
      "inputs": [
        "REGISTER"
      ],
      "outputs": [
        "agent_id bindings"
      ],
      "dependencies": [
        "auth"
      ],
      "forbidden_dependencies": [
        "event_ledger"
      ],
      "transaction_boundary": "register upsert",
      "idempotency": "idempotent REGISTER",
      "failure_modes": [
        "invalid manifest"
      ],
      "observability": "registry metrics",
      "security_boundary": "owner isolation",
      "determinism_requirements": "manifest bytes stable",
      "conformance_cases": [
        "C12"
      ]
    },
    {
      "module": "action_router",
      "purpose": "Validate and route ACT to world engine",
      "owns_state": [
        "accept receipts",
        "client action sequence cursor"
      ],
      "reads": [
        "registry",
        "auth"
      ],
      "writes": [],
      "inputs": [
        "ACT envelopes"
      ],
      "outputs": [
        "accepted actions"
      ],
      "dependencies": [
        "auth",
        "agent_registry",
        "scheduler"
      ],
      "forbidden_dependencies": [
        "world_state direct write"
      ],
      "transaction_boundary": "accept or reject only",
      "idempotency": "idempotency_key",
      "failure_modes": [
        "schema invalid",
        "forbidden"
      ],
      "observability": "action metrics",
      "security_boundary": "authz gate",
      "determinism_requirements": "validate required client_action_sequence; never assign canonical order from receive timing",
      "conformance_cases": [
        "C02",
        "C03",
        "C23"
      ]
    },
    {
      "module": "world_engine",
      "purpose": "Authoritative reducers for world truth",
      "owns_state": [
        "reducer rules version"
      ],
      "reads": [
        "world_state",
        "event_ledger head"
      ],
      "writes": [
        "via events only"
      ],
      "inputs": [
        "frozen accepted actions ordered by action_priority, agent_id, client_action_sequence, action_id",
        "director inputs"
      ],
      "outputs": [
        "atomic cycle event batch including same-cycle MESSAGE_DELIVERED",
        "next state intent"
      ],
      "dependencies": [
        "world_state",
        "event_ledger",
        "scheduler"
      ],
      "forbidden_dependencies": [
        "observation_engine",
        "spectator_projection",
        "research_capture"
      ],
      "transaction_boundary": "atomic cycle batch reduce and commit",
      "idempotency": "event idempotency keys; duplicate logical mutations return original result or deterministic conflict",
      "failure_modes": [
        "precondition fail",
        "serialization failure",
        "stale revision",
        "stale writer fence"
      ],
      "observability": "reduce latency, committed cycle batch head, aborted transaction reason",
      "security_boundary": "single fenced canonical writer; no private cognition",
      "determinism_requirements": "pure reduce(seed,state,ordered actions); message delivery before observation projection",
      "conformance_cases": [
        "C04",
        "C18",
        "C19",
        "C20",
        "C21",
        "C22",
        "C23",
        "C24"
      ]
    },
    {
      "module": "world_state",
      "purpose": "Durable canonical state store",
      "owns_state": [
        "WorldState documents"
      ],
      "reads": [],
      "writes": [
        "state revisions"
      ],
      "inputs": [
        "engine commits"
      ],
      "outputs": [
        "state snapshots reads"
      ],
      "dependencies": [
        "event_ledger"
      ],
      "forbidden_dependencies": [
        "observation_engine writes"
      ],
      "transaction_boundary": "state revision commits atomically with ledger head and budget settlement in cycle batch",
      "idempotency": "expected revision monotonic; stale revision aborts without mutation",
      "failure_modes": [
        "storage unavailable",
        "revision mismatch",
        "state/ledger divergence on crash reconciliation"
      ],
      "observability": "state size metrics, revision/head reconciliation status",
      "security_boundary": "DB credentials",
      "determinism_requirements": "byte-stable serialization",
      "conformance_cases": [
        "C15",
        "C16",
        "C26"
      ]
    },
    {
      "module": "event_ledger",
      "purpose": "Append-only authenticated event log",
      "owns_state": [
        "events",
        "digest chain"
      ],
      "reads": [
        "auth producer allowlist"
      ],
      "writes": [
        "append only"
      ],
      "inputs": [
        "atomic engine cycle event batches"
      ],
      "outputs": [
        "event streams"
      ],
      "dependencies": [
        "auth"
      ],
      "forbidden_dependencies": [
        "unauthenticated producers"
      ],
      "transaction_boundary": "append atomic contiguous cycle batch",
      "idempotency": "event_id unique; world event sequence unique and contiguous",
      "failure_modes": [
        "digest break",
        "sequence gap",
        "duplicate event sequence"
      ],
      "observability": "ledger integrity, sequence head, digest-chain head",
      "security_boundary": "no agent direct write",
      "determinism_requirements": "ordered digests preserve frozen action order provenance",
      "conformance_cases": [
        "C04",
        "C16"
      ]
    },
    {
      "module": "observation_engine",
      "purpose": "Permissioned observation projection",
      "owns_state": [
        "pending observation metadata"
      ],
      "reads": [
        "world_state",
        "events"
      ],
      "writes": [],
      "inputs": [
        "committed cycle event batch after same-cycle message delivery"
      ],
      "outputs": [
        "Observation documents"
      ],
      "dependencies": [
        "world_state",
        "event_ledger"
      ],
      "forbidden_dependencies": [
        "world_state writes"
      ],
      "transaction_boundary": "derive after committed head; delivery ack is noncanonical bookkeeping",
      "idempotency": "observation_id unique; per-stream cumulative ack cursor",
      "failure_modes": [
        "permission deny",
        "redelivery window expired"
      ],
      "observability": "obs metrics",
      "security_boundary": "redaction",
      "determinism_requirements": "same committed batch and policy -> same observation digest",
      "conformance_cases": [
        "C05",
        "C06"
      ]
    },
    {
      "module": "message_service",
      "purpose": "Message queue and delivery indexes",
      "owns_state": [
        "message records"
      ],
      "reads": [
        "world_state presence"
      ],
      "writes": [
        "via MESSAGE and MESSAGE_DELIVERED events"
      ],
      "inputs": [
        "MESSAGE actions"
      ],
      "outputs": [
        "same-cycle delivery events",
        "delivery intents"
      ],
      "dependencies": [
        "world_engine"
      ],
      "forbidden_dependencies": [
        "direct world mutation"
      ],
      "transaction_boundary": "queue during reduce; deliver in same atomic cycle batch before observation projection",
      "idempotency": "message_id unique",
      "failure_modes": [
        "recipient missing"
      ],
      "observability": "queue depth",
      "security_boundary": "content privacy",
      "determinism_requirements": "delivery cycle deterministic and replay-recorded",
      "conformance_cases": [
        "C07"
      ]
    },
    {
      "module": "scheduler",
      "purpose": "Cycle freeze, ordering, timeouts",
      "owns_state": [
        "cycle cursor",